Titre,Lien,Description,Tags,Date,Nom_de_la_chaine,Nombre_de_like,Nombre_de_vue;;;;;;
"L&#39;Amérique tombe le masque... Et nous ? #cdanslair 14.05.2021,https://www.youtube.com/watch?v=z41ef5OZmCE,""« Un grand jour. » Aux Etats-Unis, le président Joe Biden s'est félicité, hier, de la levée de la recommandation du port du masque en intérieur pour les personnes ayant été vaccinées. « Si vous êtes complètement vacciné, vous n'avez plus besoin de porter un masque ! », a-t-il affirmé. Les personnes vaccinées peuvent désormais participer sans risque « à des activités en intérieur et en extérieur, petites ou importantes, sans porter de masque ni respecter la distanciation physique ». Une avancée considérable dans la lutte contre la pandémie, dans ce pays où environ 35% de la population, soit plus de 117 millions de personnes, sont entièrement vaccinées. En France, c’est un test grandeur nature de sa politique sanitaire que s’apprête à vivre le gouvernement. Alors que le pays a enclenché son processus de déconfinement progressif, le week-end prolongé du pont de l'Ascension se profile. Les Français, usés par le dernier confinement, semblent bien décidés à profiter de l'abolition de la règle des 10 kilomètres et de la fin de l'interdiction des déplacements inter-régionaux. Dès mercredi soir à Paris, les voyageurs se pressaient dans les gares. Mais cette envie d'un air nouveau ne doit pas faire oublier les règles sanitaires de base, sous peine d’un regain de l’épidémie. C’est ce qu’a tenu à rappeler le Premier ministre Jean Castex lors de son passage sur le JT de France 2 mardi soir. Il a également demandé à la population de redoubler d'efforts, appelant les Français à se faire vacciner y compris pendant cette période. L'exécutif, qui mise sur 20 millions de premières doses administrées au 15 mai, craint en effet une baisse du rythme vaccinal durant les prochains jours. Le porte-parole du gouvernement Gabriel Attal a donc rejoint Jean Castex dans son appel, à l'issue du dernier Conseil des ministres : « il n'y a pas de pont pour la vaccination. »  Car la vaccination reste la clé principale d’une sortie de crise. Dans plusieurs pays pourtant, la campagne patine, se heurtant parfois à la réticence de citoyens. Des initiatives se multiplient donc pour convaincre les indécis de sauter le pas. En la matière, les autorités sanitaires ne manquent pas d’imagination. En Italie, aux Etats-Unis ou encore en Serbie, une injection peut se monnayer contre une bière, un chèque, un bon d’achat, l’accès à un musée ou encore une entrée au stade afin d’assister à une rencontre sportive.  En attendant qu’une partie suffisante de la population soit vaccinée, il faut lutter contre la propagation du virus. C’est l’objectif de la cellule baptisée « Comète » à Marseille. Des marins-pompiers de la ville effectuent des prélèvements dans les eaux sales afin de détecter très rapidement la circulation du virus et de ses différents variants et d’intervenir au plus vite. Selon le contre-amiral Augier : « contre le virus, il faut utiliser tous nos outils. » L'enjeu des eaux sales comme indicateur de l'épidémie monte en puissance au niveau international. Mi-mars, la Commission européenne a enjoint à tous les Etats membres de se doter d'un système de surveillance d'ici au 1er octobre – et à harmoniser leurs prélèvements sur vingt-quatre heures.  Faut-il craindre un rebond épidémiques suite au week-end du pont de l'Ascension ? Les incitations à la vaccination portent-elles leurs fruits ? Pourquoi ne pas généraliser les pratiques de la cellule « Comète » sur tout le territoire français ?  Les invités : Jean-Paul HAMON – Médecin généraliste et Président d'honneur de la Fédération des Médecins de France (FMF) Alix BOUILHAGUET – Éditorialiste politique à « Franceinfo » Pr. Philippe AMOUYEL – Epidémiologiste et professeur de santé publique à l'Université de Lille Pr. Mylène OGLIASTRO – Virologue et vice-présidente de la Société Française de Virologie  Retrouvez-nous sur : | Notre site : http://www.france5.fr/emissions/c-dan... | Facebook : https://www.facebook.com/Cdanslairf5/ | Twitter : https://twitter.com/CdanslairF5 Pas un événement important qui ne soit évoqué, expliqué et analysé dans C dans l’air. Tout au long de la semaine, les deux journalistes donnent les clés pour comprendre dans sa globalité un événement ou un sujet de première importance, en permettant aux téléspectateurs d'intervenir dans le débat ou de poser des questions par SMS ou Internet. Caroline Roux est aux commandes de l'émission du lundi au jeudi et Axel de Tarlé prend le relais le vendredi et le samedi. Diffusion : tous les jours de la semaine à 17 h 45 Rediffusion : tous les jours de la semaine à 22 h 30 Format : 65 minutes Présentation : Caroline Roux et Axel de Tarlé Réalisation : Pascal Hendrick, Jean-François Verzele et Jacques Wehrlin Production : France Télévisions/Maximal Productions"",""Castex Covid-19 France Macron coronavirus pandémie pass_sanitaire santé vaccin vaccination variants"",2021-05-15,""C dans l'air"",104,23875";;;;;;
"Ma thèse en 180 secondes (2021) - Antoine VERGNE (1er prix du jury),https://www.youtube.com/watch?v=n2CMaiy5jKg,""Ma thèse en 180 secondes // Edition 2021 // Clermont-Ferrand Antoine VERGNE Thèse : Importance écologique des interactions entre bactéries phototrophes anoxygéniques (BPA) et plantes terrestres dans différents écosystèmes Laboratoire : LMGE Université Clermont Auvergne   Notre playlist Ma thèse en 180 secondes :   https://youtube.com/playlist?list=PLlWI8gjCqBsq6PkEJaoP-psmpb960hipg  _____________________________   Abonne-toi : http://www.youtube.com/c/UniversitéClermontAuvergne/?sub_confirmation=1  LIENS ▶ Université Clermont Auvergne : https://www.uca.fr ▶ Facebook : https://www.facebook.com/universite.clermont.auvergne ▶ Twitter : https://twitter.com/ucauvergne ▶ Instagram : https://www.instagram.com/universiteclermontauvergne/ ▶ Linked in : https://fr.linkedin.com/school/universite-clermont-auvergne/ _____________________________  Réalisation : Direction de la communication de l'UCA   #MT180 #thèse #université #Clermont #UCA @Ma thèse en 180 secondes - MT180"",""MT180 MT180s Clermont Université Concours Doctorant thèse 2021"",2021-03-22,""Université Clermont Auvergne"",187,11779";;;;;;
"CRUsine Académie reçoit Ema Krusi [2021],https://www.youtube.com/watch?v=O4Aaz72BbfU,""Nos formations Pros ne sont plus éligibles CPF. Depuis plus de 20 ans, #EmaKrusi teste et expérimente diverses techniques de libération et d’autonomie psychologique. Suite à une grande demande, elle partage désormais sa philosophie de vie issue de ses années d’obstacles, de souffrances, d’échecs, d’expériences, et de réussite. Sa méthode inédite basée sur la complémentarité vidéo/podcast/livre permet d’accélérer le déclic et a aidé de nombreuses personnes en quête de résultats rapides et profonds.                    “Écrire son histoire au lieu de subir celle des autres au quotidien” Formation """"DECLIC"""" ,   https://emakrusi.com/  ▬▬▬▬▬▬▬▬▬▬▬▬▬ NOS FORMATIONS PRO  100% prise en charge par les aides de l'état.  Cliquez sur le lien ‍  : https://www.crusineacademie.com ▬▬▬▬   QUI SUIS-JE ▬▬▬▬  Je suis Cilou,  mentor pour entrepreneuse et j’aide des femmes merveilleuses à développer leur compétences  en crusine afin de créer leur job de rêve.  J’ai toujours pris un immense plaisir à créer et partager mes connaissances ainsi que mon énergie positive. Mon souhait à toujours été de me créer un job qui allie à la fois passion, liberté et revenus significatifs. J’ai développé des stratégies efficaces pour trouver et fidéliser ma cliente idéale et ainsi propulser mes ventes et mon business.  Aujourd’hui, je veux vous aider vous aussi à mettre en place tes ateliers à succès et à prendre confiance en vous. Je souhaite vraiment être pour vous une source d’inspirations positives.  ▬▬▬▬   TU PEUX AUSSI ME SUIVRE ICI  ▬▬▬▬            ⬇️⬇️⬇️⬇️⬇️⬇️⬇️⬇️⬇️⬇️⬇️⬇️⬇️⬇️   FACEBOOK https://www.facebook.com/crusineacademie  INSTAGRAM https://www.instagram.com/ciloucrusine/  #emakrusi #fairelepoint #allermieux"",,2021-08-04,""Cilou CRUsine Académie"",1550,35260";;;;;;
"Briefing presse après le Conseil de gouvernement (04.02.2022),https://www.youtube.com/watch?v=nlOBZeXEedU,""Le Premier ministre, ministre d'État, Xavier Bettel, et la ministre de la Santé, Paulette Lenert, informent la presse sur les travaux du Conseil de gouvernement.  Transcript sous-titrage : https://gd.lu/ftsgh8"",""Luxembourg corinavirus luxemburg Lëtzebuerg covid covid19 santé mesures Xavier_Bettel conseil chambre Chamber Restriktiounen restrictions COVID-19 corona virus"",2022-02-04,""Gouvernement LU"",,4474";;;;;;
"Marginalisé: réflexions sur l’isolement du Canada dans les relations internationales,https://www.youtube.com/watch?v=cUeBu1bI7VY,""Justin Trudeau avait promis lors de son arrivée au pouvoir, en 2015, que le Canada serait de retour comme acteur important et respecté de la scène internationale. Or, son échec, cinq ans plus tard, à obtenir un siège de membre non permanent au Conseil de sécurité de l’Organisation des Nations unies (ONU) sonna le glas de cet espoir et a fait réaliser à plusieurs que l’influence globale du Canada était plutôt en déclin. Pour ceux et celles qui ont connu l’époque glorieuse d’un Canada largement perçu comme un acteur désintéressé, principal contributeur de Casques bleus dans des situations difficiles et en mesure de bâtir des ponts avec des puissances aux idéologies opposées, la réalité d’aujourd’hui est difficile à accepter.  Dans ce livre, Jean-François Caron (Senior Fellow à l’IPD) explore les raisons qui participent à cet isolement de plus en plus grandissant du Canada en expliquant que la marginalisation internationale du Canada est le résultat de l’effondrement du paradigme dit de la « convergence libérale » né à la fin de la guerre froide et dont le Canada a été au fil du temps un ardent défenseur. Or, avec l’émergence d’un monde désormais organisé de plus en plus par une opposition entre un ordre démocratique et un bloc illibéral organisé autour de l’axe Pékin-Moscou, les orientations du Canada en matière de politique étrangère au cours des 25 dernières années ne peuvent qu’entraîner son effacement global.  Caron et les autres contributeurs à cet ouvrage s’intéressent aux raisons de la marginalisation du Canada sur la scène internationale. Leur intention est aussi de fournir aux lecteurs une analyse plus théorique de l’évolution de l’ordre international post-1991 dans le but d’expliquer ses fondements, comment il s’est manifesté concrètement ainsi que les raisons de son effritement graduel au cours des 20 dernières années.   Panélistes : – Jean-François Caron, professeur agrégé, Université Nazarbayev et Senior Fellow, IPD – Jocelyn Coulon, chercheur, Centre d’études et de recherches internationales, Université de Montréal (CÉRIUM), ancien conseiller politique principal du ministre des Affaires étrangères Stéphane Dion (2016-2017) et membre du conseil consultatif, IPD – Frédéric Boily, professeur titulaire, Campus Saint-Jean, Université de l’Alberta – Louise Blais, ancienne ambassadrice et représentante permanente adjointe du Canada auprès des Nations Unies à New York (2017-21)  ️Modérateur : – Zachary Paikin, chercheur non-résident, IPD et chercheur, Centre for European Policy Studies (Bruxelles)   Commander le livre : https://www.pulaval.com/livres/marginalise-reflexions-sur-l-isolement-du-canada-dans-les-relations-internationales   Suivez-nous: – Site web : https://peacediplomacy.org/ – YouTube : https://www.youtube.com/c/InstituteforPeaceDiplomacy/?sub_confirmation=1 – Twitter : https://twitter.com/Diplomacy_Peace – LinkedIn : https://www.linkedin.com/company/the-institute-for-peace-diplomacy – Facebook : https://www.facebook.com/PeaceDiplomacyOrg – Instagram : https://www.instagram.com/peacediplomacyorg/   Faire un don : https://peacediplomacy.org/donate/"",,2022-08-20,""Institute for Peace & Diplomacy"",4,181";;;;;;
"La face cachée de MrBeast,https://www.youtube.com/watch?v=S-FCMkGRmWY,""Comment fonctionne le plus gros YouTuber du monde ? ► Ne rate aucune des vidéos : http://bit.ly/HardiskYT ► Rejoins moi en LIVE : https://cutt.ly/jUU2qPN ► Inscrit toi à la Newsletter : https://cutt.ly/aQrvb7N  ► Mes super réseaux sociaux  DISCORD : http://discord.gg/Hardisk INSTAGRAM : http://www.instagram.com/Hardisk TWITTER  : http://www.twitter.com/Hardisk  FACEBOOK : http://www.facebook.com/HardiskVideos  ► Le matériel que j'utilise : https://amzn.to/399g1ib"",""mister_beast mr_beast mrbeast_france mrbeast_suisse mrbeast_canada cache_cache mr._beast mr_best_fr"",2022-05-14,Hardisk,24029,487030";;;;;;
"Actualis, le podcast  S3 E21 :  Isolation, Linguistique et Oligarques russes,https://www.youtube.com/watch?v=fZ8qewmxRPA,""Pour ce vingt-et-unième numéro de la saison 3 d'Actualis vous retrouvez autour de la table Baptiste, Aurore, Philippine, Pauline et Audrey ainsi que Edouard à la présentation.  🟣 Au programme :  - La chronique de Baptiste : La chasse aux passoires thermiques  - L’interview par Philippine:  Langage et Immigration, rencontre avec Océane Foubert, linguiste doctorante et lectrice en linguistique anglaise à l'Université de Lille - La chronique d’Aurore: Traque des oligarques russes sur Internet  - Le Maxi Quizz présenté par Baptiste  🟣 Time line :   00:00 : début  01:17 : La chronique de Baptiste 11:02 : L’interview par Philippine 19:25: La chronique d’Aurore 26:09 : Maxiquizz  🟣 Pour plus de quizz et d'information, suivez-nous sur nos réseaux :   - Facebook: https://www.facebook.com/ActualisPodcast - Instagram : https://www.instagram.com/actualis.podcast - Twitter : https://twitter.com/Actualis_ -Podcast Spotify : https://open.spotify.com/show/79fITSNUJvuUmtH9G0Mfb8?si=vqvk3KxxQuSN13cFqUDxow  Montage: Pauline Moyer"",,2022-03-31,Actualis,0,35";;;;;;
"Recyclage, design et métier d&#39;art - Rencontres des Gobelins 2022,https://www.youtube.com/watch?v=ZwtWqin457s,""Intervenants :  Mélanie Fourcy (Les Canaux, Paris) - Sublimer les matières rebuts grâce aux métiers d'art : retour d'expérience de l'association Les Canaux Valérie Accary, Sandrine Couroyer (Les MétamorFoses) - Les MétamorFoses : sublimer les imperfections par l'upcycling artistique Antonin Mongin (designer, docteur en design textile) - L'Artisanat d'art du cheveu coupé. Réveil d'une pratique oubliée valorisant les chutes capillaires  2. Savoir-faire, design, et développement durable. Une rencontre Slow Made en partenariat avec la Fondation Banque Populaire  11 octobre 2022 http://www.mobiliernational.culture.gouv.fr/fr/expositions-et-evenements/debats-et-conferences/saison-20222023"",,2022-10-20,""Mobilier national"",3,72";;;;;;
"Séminaire Hommage à Anne-Laure Bonvalot: sentir-penser des mondes en relation,https://www.youtube.com/watch?v=FJ1hOHbhuPY,""20 octobre 2022 Université Paul-Valéry Montpellier Unité ReSO Recherches sur les Suds et les Orients 0:00 Introduction 7:30 Florence Even 10:40 Jean-François Carcelen 32:38 Nathalie Sagnes-Alem 55:23 Angela Biancofiore 1:23:40 Bénédicte Meillon 2:00:24 Alfons Cervera 2:20:40 Maria Blanco"",,2022-10-21,""Théories et pratiques du Care"",4,92";;;;;;
"Actualis, le podcast  S3 E21 :  Isolation, Linguistique et Oligarques russes,https://www.youtube.com/watch?v=fZ8qewmxRPA,""Pour ce vingt-et-unième numéro de la saison 3 d'Actualis vous retrouvez autour de la table Baptiste, Aurore, Philippine, Pauline et Audrey ainsi que Edouard à la présentation.  🟣 Au programme :  - La chronique de Baptiste : La chasse aux passoires thermiques  - L’interview par Philippine:  Langage et Immigration, rencontre avec Océane Foubert, linguiste doctorante et lectrice en linguistique anglaise à l'Université de Lille - La chronique d’Aurore: Traque des oligarques russes sur Internet  - Le Maxi Quizz présenté par Baptiste  🟣 Time line :   00:00 : début  01:17 : La chronique de Baptiste 11:02 : L’interview par Philippine 19:25: La chronique d’Aurore 26:09 : Maxiquizz  🟣 Pour plus de quizz et d'information, suivez-nous sur nos réseaux :   - Facebook: https://www.facebook.com/ActualisPodcast - Instagram : https://www.instagram.com/actualis.podcast - Twitter : https://twitter.com/Actualis_ -Podcast Spotify : https://open.spotify.com/show/79fITSNUJvuUmtH9G0Mfb8?si=vqvk3KxxQuSN13cFqUDxow  Montage: Pauline Moyer"",,2022-03-31,Actualis,0,35";;;;;;
"ABC paris : Rencontre littéraire et échanges avec Fanny Colonna (Lundi 3 décembre 2012),https://www.youtube.com/watch?v=OvcNNl0nkcc,""Lundi 3 décembre 2012  Au cours de """"La semaine Chaouis"""" organisée par  l'ACB, Fanny Colonna présente son livre « Le meunier, les moines et le bandit » (Sindbad -- Actes Sud). Récits - La Vie quotidienne dans les Aurès (Algérie) au tournant du XXe siècle.  Avec l'intervention de Zalani Azzedine  Source : ACBparis"",""chaoui cawi shawi chawiya Algérie Algeria Batna Khenchela Oum_el_bouaghi Ain_beida Ain_fakroun Sétif el_eulma bir_el_arch bellaa guelma souk_ahrass annaba skikda constantine khroub taref tebessa chrea zoui tkoukt arris maghreb tunis maroc libye aurès tarifit khenchela fanny_colonna Fanny_Colonna"",2019-03-12,""Vidéo chaoui"",7,533";;;;;;
"JE PARS À L&#39;ARMÉE !!,https://www.youtube.com/watch?v=u-v07taMbIQ,""Je deviens militaire dans l'armée de terre!  Clique ici pour t'abonner ► http://bit.ly/1qAbjhL & rejoins la TeamShape ! Mes vêtements ► http://bit.ly/1wXqeD7  Mes programmes ►http://bit.ly/2iWtdz9 Ma salle de sport ►http://bit.ly/2jaOdSO  Pour tout savoir sur les métiers de l’armée de Terre : =https://ad.doubleclick.net/ddm/trackclk/N3021.2108124YOUTUBEFR/B20556450.229207536";dc_trk_aid=427066862;dc_trk_cid=106021865;dc_lat=;dc_rdid=;tag_for_child_directed_treatment=;"tfua  Tout savoir sur le CFIM : https://www.youtube.com/watch?v=YwQehQKbnoc&t=3s  Facebook : @armeedeterrerecrute Twitter : @RecrutemenTerre  Instagram : armeedeterrerecrute  Réduction MyProtein ► https://goo.gl/28Zr8A code """"TIBO""""  HARCÈLE-MOI sur :  TWITTER : http://bit.ly/1o88uUV INSTAGRAM : http://bit.ly/1Q4RInr (tiboinshape) SNAPCHAT : tiboinshape MUSICAL.LY : tiboinshape FACEBOOK : http://on.fb.me/1EcbKme SPOTIFY : Tibo InShape - Motivation (playlist)  Mon adresse postale :  """"Tibo Inshape CS 52072 81012 ALBI CEDEX""""  Mon e-mail (business uniquement) ► tiboinshapevideo@gmail.com  Si vous lisez cette phrase écrivez « DAAMN » en commentaire !"",""tibo_inshape teamshape militaire_tibo"",2018-09-13,""Tibo InShape"",483488,8908264"
"52 minutes pour comprendre l&#39;hôpital psychiatrique de Bingerville.,https://www.youtube.com/watch?v=CQW2qQmshGc,""Bienvenue sur la chaîne officielle Youtube du Groupe RTI .   Retrouvez ici tous les  programmes de la RTI 1, de RTI 2 et de Radio Côte d'Ivoire  en Replay. http://www.rti.ci https://www.facebook.com/RTIGROUPE https://twitter.com/RTIOfficiel"",""RTI_2 GROUPE_RTI CÔTE_D'IVOIRE ABIDJAN DIRECT BINGERVILLE ELIANE_ERVO"",2020-02-21,""RTI Officiel"",185,16923";;;;;;
"Pour en finir avec les douleurs chroniques - 36.9°,https://www.youtube.com/watch?v=IZo78BZL_zQ,""Pour en finir avec les douleurs chroniques - 36.9°  Tous les reportages de 36.9°: https://youtube.com/RTSsanté  La peur d'avoir mal ainsi que la douleur peuvent durablement s'inscrire dans notre cerveau. Des découvertes en orthopédie et de nouvelles approches dans le domaine de l'antalgie permettront d'aider des personnes victimes de pathologies très diverses.  On observe qu’après une chirurgie orthopédique, certaines personnes reprennent leurs activités et même le sport exactement comme avant. D’autres en revanche ne récupèrent pas bien alors même que le bilan clinique est normal. Une sorte d’appréhension s’installe et ils ne parviennent pas à refaire les gestes d’avant. Pourquoi ? La réponse est logée dans notre cerveau.  Une équipe de chercheurs genevois a conduit une recherche totalement inédite dans ce domaine. Françoise Ducret et  Ventura Samarra les ont rencontrés. Qu’il s’agisse de douleurs neuropathiques ou fibromyalgiques, il s’agit là aussi d’aller explorer les circuits de la douleur, de la mémoire et des émotions qui sont intimement liés dans notre cerveau. Là aussi, il s’agit de le rééduquer ! Cette enquête passionnante nous éclaire sur l’efficacité des nouveaux outils thérapeutiques.  Extrait de 36.9°, une émission de la Radio Télévision Suisse, du 4 novembre 2015  Retrouvez 36.9°:  Youtube: https://youtube.com/RTSsanté Site: http://rts.ch/sante Facebook: https://facebook.com/RTS369 #RTSsanté  Retrouvez la Radio Télévision Suisse: Youtube: https://youtube.com/RTS Site: http://rts.ch"",""anti-douleurs douleur antalgie émotions rééducation thérapeutique soigner soins médicaments cerveau neurologie antalgique peur réadaptation RTS_Santé 36-9 36.9 Suisse"",2017-07-19,36.9,243,23263";;;;;;
"[AVS] &quot;Comment j’ai perdu 50 kilos ?&quot; avec Coumba Davy,https://www.youtube.com/watch?v=VSSQ3s2j-wM,""Pour retrouver, Coumba Davy (art thérapeute et danse thérapeute), fondateur de Human Dance Life : http://www.coumbadavy.com/  Abonne-toi à la chaîne Beur FM  http://bit.ly/2tLLJOP  Site  http://beurfm.net/ Facebook  https://www.facebook.com/BeurFMOfficiel/  Twitter  https://twitter.com/beurfm  Instagram  https://www.instagram.com/beurfm_officiel/  Snapchat  beurfm"",""Coumba_Davy Danse Art_thérapie Perte_de_poids Maigrir Mincir Perte_de_50_kg Poids Régime Radio Live Beur_FM Sport Obésité Human Méditation"",2019-01-11,""Beur FM"",42,1975";;;;;;
"Penser des mondes en relation : Hommage à Anne-Laure Bonvalot,https://www.youtube.com/watch?v=N7CXzHOd6tk,""L'unité de recherche ReSO organise un séminaire en hommage à Anne-Laure Bonvalot, maîtresse de conférences en Études hispaniques, qui  nous a quittés le 10 janvier 2022 à l'âge de 38 ans à cause d'une grave maladie. Elle était membre de ReSO et du GIS Théories et pratiques du care. pour revoir le séminaire voici le lien  https://youtu.be/FJ1hOHbhuPY    Jeudi 20 octobre 2022 de 14h30 à 18h  salle 003-Caryatides à St Charles 2 Université Paul-Valéry, Montpellier  Le séminaire présente différents aspects des activités scientifiques, littéraires et politiques de Anne-Laure Bonvalot: son travail de critique littéraire,  de traductrice et d'enseignante, son engagement pour le développement de l'écopoétique des Suds, son militantisme.  Programme: Jeudi 20 octobre 2022 (de 14h30 à 18 h) Site Saint Charles 2, Salle des Caryatides (003) et distanciel    Jean-François Carcelén Professeur Émérite de Littérature espagnole contemporaine (ILCEA4, Université Grenoble-Alpes) Anne-Laure Bonvalot : « Formes nouvelles de l’engagement dans le roman espagnol actuel »  Nathalie Sagnes -Alem Professeure de Littérature espagnole contemporaine (ReSO, Université Paul Valéry-Montpellier 3) Anne-Laure Bonvalot : une recherche écoféministe et décoloniale « La bâtarde : fable intersectionnelle, conte initiatique et roman anthropologique. Le point de vie d’une enfant grandie sur les formes de la domination ordinaire » (texte d’Anne-Laure Bonvalot)  Angela Biancofiore Professeure en Études italiennes (ReSO, Université Paul Valéry-Montpelllier) Anne-Laure Bonvalot : faire résonner les voix du Sud Global, vers une écopoétique du plurivers  Bénédicte Meillon Maîtresse de Conférences Habilitée à Diriger des Recherches en Études anglophones (CRESEM, Université de Perpignan Via Domitia) Échos poétiques de la forêt dans Enfance d'un chamane, d'Anne Sibran : quelques pistes pour se mettre au diapason des peuples premiers et de la terre  Alfons Cervera, Écrivain et journaliste Si callas, todavía te oyes tú  Maria Blanco Présidente de l’Association Teriya-Solidarité Présentation du projet “Fonds Anne-Laure Bonvalot de la bibliothèque hispanique de l’université Houphouët Boigny d’Abidjan”   Intervention de Jérôme Cantié (Département Cinéma, Audiovisuel, Nouveaux médias) et Ahmad Joumblat (Studio Numérique - Centre de Ressources Multimédia, Audiovisuel et Data), Université Paul Valéry Montpellier 3"",,2022-10-21,""Théories et pratiques du Care"",6,328";;;;;;
"Rencontre intergénérationnelle autour du travail social,https://www.youtube.com/watch?v=X5t03Juf2gg,""Rencontre intergénérationnelle autour du travail social et de l’expérience historique du Département parallèle de travail social (1969-1972) à l’UdeS"",,2022-10-19,""AGORA UdeS"",5,108";;;;;;
