Titre,Lien,Description,Tags,Date,Nom_de_la_chaine,Nombre_de_like,Nombre_de_vue;;;;;;
"Le mal-être étudiant,https://www.youtube.com/watch?v=X-Yp2s44Zb8,"" Précarité... Les raisons du mal-être étudiant sont nombreuses. Mais il existe des solutions ! ▶ + de #DecodActu : http://bit.ly/Decod-Actu Abonne-toi !  http://bit.ly/2QLeh5V  #Lumni #Etudiants #Colère #Société  La vie étudiante, l’âge de l’insouciance ? Pas si simple ! Pour les près de 3 millions d’étudiants formés chaque année, cette période charnière peut aussi s’avérer source de mal-être.  De quoi les étudiants souffrent-ils ?  Selon une étude réalisée auprès d’un panel de 800 étudiants, un tiers d’entre eux se déclare stressé en permanence, et la moitié rencontre des problèmes pour s’ endormir.  Une autre étude menée auprès de 20 000 étudiants confirme ce malaise. Elle révèle que près 2 étudiants sur 10 suivent un traitement contre l’anxiété, l’angoisse et le stress, ou bien ingèrent des médicaments pour se concentrer.  Autre phénomène préoccupant, les étudiants sont aussi touchés par la dépression. Selon l’Observatoire de la vie étudiante, elle a atteint 15 % d’entre eux en 2018.  D’après le ministère de la Santé, le phénomène a tendance à s’accentuer. Entre 2005 et 2017, la dépression a augmenté de 4 points chez les étudiants.  Un malaise parfois tel que 8 % des étudiants déclarent avoir pensé au suicide au cours des 12 derniers mois.  Quelles sont les causes du mal-être ?  - Les périodes d’examens et l’orientation sont une des principales sources de stress. Certaines filières comme celles de la santé sont particulièrement éprouvantes.  En médecine par exemple, la compétition est féroce : les internes ont de lourdes responsabilités et leurs semaines de travail dépassent souvent les 48 heures légales. Conséquence : plus de 6 étudiants en médecine sur 10 souffrent d’anxiété.  Un chiffre près de 2 fois plus élevé que dans la population française.  - La précarité est aussi en cause. Depuis 2009, le coût de la vie étudiante n’a cessé d’augmenter. Le prix des loyers grimpe alors que dans le même temps, les aides au logement ont été réduites dès 2016 pour certains étudiants, et pour tous à partir de 2017.  Dans ce contexte, 1 étudiant sur 2 doit travailler, ce qui renforce les inégalités. Selon le syndicat étudiant UNEF, un tiers d’entre eux considère qu’être obligé de travailler en parallèle de leur cursus scolaire est une source de stress. L’INSEE a par ailleurs observé qu’occuper un emploi réduit de près de moitié les chances de réussir ses études.  Quelles sont les solutions proposées ?  Pour prévenir l’isolement, s’investir dans une des 5000 associations étudiantes peut être un premier pas. Les bureaux d’écoute psychologique universitaire ou les services inter-universitaires de médecine préventive et de promotion de la santé, proposent un suivi psychologique gratuit, assuré par des professionnels.  Sur le plan financier, le gouvernement prévoit de refondre le panel d’aides variées, parfois mal connues, en une aide globale d’autonomie. Un vaste chantier qui devrait être lancé en 2020.  Suivez Lumni sur :  Facebook ▶ https://www.facebook.com/lumnifr  Twitter ▶ https://twitter.com/lumni.fr  Instagram ▶ https://www.instagram.com/lumnifr  Lumni.fr ▶ https://www.lumni.fr"",,2019-11-28,Lumni,499,22882";;;;;;
"Enquête | Mystère à La Havane,https://www.youtube.com/watch?v=qd_1rFInvLk,""Reportage du 19 septembre 2019   Depuis la fin 2016 et jusqu’en 2019, des symptômes étranges sont apparus chez des diplomates américain et canadiens en poste à Cuba. L’affaire a engendré une crise diplomatique lorsque l’hypothèse de mystérieuses « attaques acoustiques » a été évoquée pour tenter d’expliquer ce qui s’était passé. Un nouveau climat de Guerre Froide s’est installé dans les relations américano-cubaines. Des enquêtes policières et scientifiques et médicales ont été conduites par des Cubains, des Américains et des Canadiens. Le mystère demeure. Cuba a donné à notre équipe un accès exceptionnel à ses enquêteurs, ceux-ci revisitant avec nous le théâtre des événements. Des documents obtenus au Canada comme à l’étranger permettent de lever en partie le voile sur cette affaire.  Journaliste : Luc Chartrand  Réalisateur : Martin Movilla Monteurs : Charles Bergeron, Philippe Duong, Bernard Lapointe Caméramans de Montréal : Karl Boulanger, Jean-Pierre Gandin, Laurent Racine Caméramans de Cuba : Daniel Chile,  Roberto Chile, Danny Gosselin Preneurs de son : Diane Gaudreau,Sylvain Renzo, Martin R. Thibault"",,2019-09-20,""Radio-Canada Info"",,341414";;;;;;
"BORIS CYRULNIK : Pourquoi dire non, langage totalitaire et résistance (conférence),https://www.youtube.com/watch?v=I9YvILTA5Y8,""Boris Cyrulnik, Docteur en médecine, Neuropsychiatre, Neurologue, auteur de nombreux livres grands publics et professionnels a animé le 21 octobre 2021 une conférence intitulée """"Pourquoi dire non, langage totalitaire et résistance"""" dans les locaux de l'Université Clermont Auvergne.  Pourquoi lors de catastrophes (naturelles, sociales, ou dictature, etc.), certaines personnes ont le courage ou la force de dire non, alors que d'autres ont le plaisir de se soumettre ?  Cette conférence a été organisée par @Clermont Auvergne Métropole en partenariat avec l'UCA.  ▶ Notre playlist """"Conférences"""" : https://youtube.com/playlist?list=PLlWI8gjCqBsrq6TbRz6jtI-yPsx3BG4I- _____________________________  CHAPITRES  00:00:00 • Introduction 00:00:23 • Conférence 01:06:50 • Questions du public _____________________________   Abonne-toi : http://www.youtube.com/c/UniversitéClermontAuvergne/?sub_confirmation=1  LIENS ▶ Université Clermont Auvergne : https://www.uca.fr ▶ Facebook : https://www.facebook.com/universite.clermont.auvergne ▶ Twitter : https://twitter.com/ucauvergne ▶ Instagram : https://www.instagram.com/universiteclermontauvergne/ ▶ Linked in : https://fr.linkedin.com/school/universite-clermont-auvergne/ _____________________________  Filmé par http://www.wellproduction.fr/  #BorisCyrulnik #conférence #UCA #université #Clermont #2021"",""clermont Auvergne université Conférence Boris_Cyrulnik résistance pass_sanitaire vaccin covid-19 résilience dire_non cyrulnik 2021 Raoult Macron révolution covid coronavirus"",2021-11-05,""Université Clermont Auvergne"",10826,639984";;;;;;
"Dans l&#39;enfer des prisons japonaises,https://www.youtube.com/watch?v=z5PgbnqQimA,""Enquête sur le système carcéral japonais et ses règles particulièrement strictes, et rencontre avec un ancien détenu. Fin 2018, la détention de Carlos Ghosn a fait connaître au grand public les conditions de vie dans les prisons nippones. Sont-elles l'enfer que décrit son épouse ? A Tokyo, les journalistes ont rencontré Isanori, un ancien détenu aujourd'hui libre de parler. Il le fait de façon anonyme, car peu de gens au Japon osent critiquer le système carcéral. Pour avoir monté une arnaque, Isanori a découvert à 23 ans un univers où la moindre action est réglementée, minute par minute : manger, boire, aller aux toilettes, dans quelle position dormir, regarder par la fenêtre… Même s'essuyer le visage avec une serviette l'été nécessite une permission spéciale. Lors des déplacements en groupe, les gardes imposent une façon de marcher militaire : bras tendu, main à hauteur d'épaule – même les doigts ne doivent pas être pliés. """"Ils veulent que votre corps lui-même ait appris les règles, pense Isanori. Si vous n'êtes pas capable de suivre des règles aussi simples, ça veut dire que vous n'êtes pas prêt à réintégrer la société."""" Une société japonaise très codifiée, où les valeurs du groupe priment sur la liberté de chacun.   00:00 Le système des prisons japonaises  2:17 Prison de Yamaguchi 5:24 À la cantine, le repas dure 13 minutes 7:30  À 23 ans il découvre la prison 9:11 Le cas Carlos Ghosn 14:08 Il a vécu le cauchemar des garde à vue japonaises 18:55 Le sort des anciens prisonniers 21:40 Un système dur mais efficace 23:28 Iwao Hakamada, le prisonnier qui a attendu 48 ans son exécution  © BABEL DOC-BABEL PRESS Réalisateur : Constantin Simon  Suivez nous sur les réseaux : Facebook : https://www.facebook.com/InvestigationsEnquetes"",""reportage documentaire japon prison carlos_ghosn détenu carcéral enquete témoignage Yamaguchi"",2022-01-28,""Investigations et Enquêtes"",50348,5745394";;;;;;
"Pour en finir avec les douleurs chroniques - 36.9°,https://www.youtube.com/watch?v=IZo78BZL_zQ,""Pour en finir avec les douleurs chroniques - 36.9°  Tous les reportages de 36.9°: https://youtube.com/RTSsanté  La peur d'avoir mal ainsi que la douleur peuvent durablement s'inscrire dans notre cerveau. Des découvertes en orthopédie et de nouvelles approches dans le domaine de l'antalgie permettront d'aider des personnes victimes de pathologies très diverses.  On observe qu’après une chirurgie orthopédique, certaines personnes reprennent leurs activités et même le sport exactement comme avant. D’autres en revanche ne récupèrent pas bien alors même que le bilan clinique est normal. Une sorte d’appréhension s’installe et ils ne parviennent pas à refaire les gestes d’avant. Pourquoi ? La réponse est logée dans notre cerveau.  Une équipe de chercheurs genevois a conduit une recherche totalement inédite dans ce domaine. Françoise Ducret et  Ventura Samarra les ont rencontrés. Qu’il s’agisse de douleurs neuropathiques ou fibromyalgiques, il s’agit là aussi d’aller explorer les circuits de la douleur, de la mémoire et des émotions qui sont intimement liés dans notre cerveau. Là aussi, il s’agit de le rééduquer ! Cette enquête passionnante nous éclaire sur l’efficacité des nouveaux outils thérapeutiques.  Extrait de 36.9°, une émission de la Radio Télévision Suisse, du 4 novembre 2015  Retrouvez 36.9°:  Youtube: https://youtube.com/RTSsanté Site: http://rts.ch/sante Facebook: https://facebook.com/RTS369 #RTSsanté  Retrouvez la Radio Télévision Suisse: Youtube: https://youtube.com/RTS Site: http://rts.ch"",""anti-douleurs douleur antalgie émotions rééducation thérapeutique soigner soins médicaments cerveau neurologie antalgique peur réadaptation RTS_Santé 36-9 36.9 Suisse"",2017-07-19,36.9,243,23263";;;;;;
"Présentiel, hybride ou distanciel : quels formats pour la rentrée 2020 ?,https://www.youtube.com/watch?v=U1OYDZz6vk8,""L’Association Nationale des Services TICE et Audiovisuels de l’enseignement supérieur (ANSTIA), en partenariat avec Wooclap vous propose à travers les témoignages de Chrystèle Gouy Université Jean Monnet et  de Jean-François Van De Poël de l’Université de Lausanne (UNIL) de préparer votre rentrée.  Interrogés par Fabien Maurin, Project Manager France chez Wooclap, voici les sujets abordés :  - Numérique pour l'enseignement et la recherche  - Quels formats d’enseignement pour ma rentrée 2020 ? - Quelles pratiques pédagogiques puis-je mobiliser ?  - Quelles fonctionnalités de Wooclap puis-je utiliser pour renforcer l’interactivité de mes cours en distanciel comme en présentiel ?  Nous vous invitons à consulter l'outil Wooclap pour enseigner à distance : https://www.wooclap.com/fr/"",""edtech education woobinar backtoschool rentrée2020"",2020-06-18,Wooclap,15,2910";;;;;;
"Bélier Horoscope Novembre 2022 Sentimental,https://www.youtube.com/watch?v=Fo7b7mGlofE,""Me contacter  ️ 06.46.36.13.14 Retrouvez moi sur Facebook https://www.facebook.com/guidancede.francoise.7 laguidancedefrancoise@gmail.com"",""voyance tirage_oracle Bélier Taureau Cancer Lion Vierge Balance Scorpion Sagittaire Capricorne Verseau Poisson amour Sentiment Cartologie Tarot Voyance Cartomancie Médiumnité Cartes Psychanalyse Coach Intuition Tirage_du_jour"",2022-10-19,""La guidance de Francoise"",42,543";;;;;;
"Être architecte logiciel en 2018 (C. Martraire, A. Loyer),https://www.youtube.com/watch?v=1igv2rHGKfo,""Vous songez à devenir architecte, ou vous l'êtes déjà sans avoir eu de formation ? Vous voulez approfondir vos compétences en architecture pour être plus performant-e dans votre équipe ? Cette université est pour vous et va vous donner les clés de l'architecture logicielle.  Par une mise en situation concrète et ludique qui alterne entre l'échelle de l'application et celle du système en entier, vous découvrirez les enjeux essentiels de l'architecture et les principaux outils théoriques associés : définition des frontières, couplage & contrats, autorité des données, styles d'implémentation, cohérence & communication. Nous évoquerons aussi les modes d'échecs, les illusions perverses, et les évolutions de l'architecture."",DevoxxFR18,2018-05-02,""Devoxx FR"",431,33873";;;;;;
"15 Astuces et Nouveautés Cachées sur iOS 15 !,https://www.youtube.com/watch?v=gMGcF5j1bUQ,"" Les protections RhinoShield :http://bit.ly/Steven21_Rhino -5% sur TOUT LE SITE avec le code STEVEN21 * RhinoShield sponsorise une partie de cette vidéo *  Voici quelques petites astuces et fonctions cachées des nouveautés d'iOS 15 pour qui peuvent vous servir sur votre iPhone   #iOS15 #Apple #iPhone  Timecode : 0:00 : Intro 0:44 : Le glisser déposer 2:07 : Manettes Xbox et PS 2:48 : Recherche de musiques  4:14 : Zoom rapide en vidéo 4:39 : Données EXIF des photos 5:34 : Publicité 6:38 : Safari 7:57 : Dictaphone 8:46 : Reconnaissance de texte 9:40 : Spotlight 10:38 : Contacts 10:57 : Verrouiller un document 12:08 : Horloge 12:57 : Ecran d’accueil et Pages 13:26 : Lecteur vidéo natif 14:06 : iCloud 15:28 : Bye Bye   Tout mon matériel : https://kit.co/StevenLathoud/mon-materiel  Les musiques que j'utilise : http://bit.ly/StevenMusicYT (2 mois gratuits)  ============================= * Certains liens sont affiliés ce qui signifie que sans frais supplémentaires pour vous, j'obtiendrai une petite commission de la part du site marchand si vous cliquez dessus et effectuez un achat.  Cela aide à ce que la totalité de mon contenu reste gratuit, merci ! =============================  ME SUIVRE SUR LES RESEAUX SOCIAUX ► Instagram: https://www.instagram.com/StevenLathoud/ ► Twitter: https://twitter.com/73steven ► Facebook: http://www.facebook.com/73steven ► Website: http://www.stevenlathoud.com/  ▬▬▬▬▬▬▬▬▬▬▬▬▬▬▬▬▬▬▬▬▬▬▬▬▬▬▬▬▬"",""iOS_15 Apple iPhone iPad iPadOS nouveautés widgets FaceTime iMessage Steven_Lathoud iOS_15_review iOS_15_Focus Astuces_iOS_15"",2021-09-21,STEVEN,30155,1018064";;;;;;
"Leçon inaugurale: La science des matériaux du matériau de rencontre au matériau sur mesure,https://www.youtube.com/watch?v=UpKPCyUFeK4,,,2014-10-13,""Cemam Communication"",19,4795";;;;;;
"Quand Hervé Mariton chante une &quot;chanson anar de droite soviétique&quot;,https://www.youtube.com/watch?v=EMkqmqpwLc4,""A chacun sa manière de faire passer ses idées. Hervé Mariton, candidat à la primaire de la droite et du centre, a dénoncé les """"bobards"""" des adversaires de son propre camp et des autres partis. Pour s'opposer à ceux qui plaident pour l'isolement de la France, lors de l'université d'été des Républicains, il assure qu""""'il n'y a pas de souveraineté sans alliés"""". Son """"tropisme"""" le porterait plus vers la Russie. Et pour prouver cet attrait, Hervé Mariton a chanté """"une chanson anarchiste de droite anti-soviétique"""" qu'il a entonné sur la scène de La Baule."",""politique hervé mariton baule républicains"",2016-09-03,BFMTV,12,3853";;;;;;
"Bénévoles et isolement social en temps de pandémie,https://www.youtube.com/watch?v=odCHLtIGIaE,""Compte tenu des préoccupations croissantes concernant l'isolement social, la santé mentale, le bien-être et la fatigue associés à la pandémie, Bénévoles Canada a choisi de se pencher sur comment soutenir les bénévoles et leur bien-être en ces temps difficiles. Dans ce webinaire, nous sommes rejoints par deux invités : Catherine Harton de l’Association canadienne pour la santé mentale présente la situation dans son ensemble et partage des outils pour soutenir une bonne santé mentale et Djakaridja Koné du Centre d’action bénévole et communautaire de Saint-Laurent présente un programme que son organisme a récemment mis en œuvre dans le but de contrer l’isolement social chez les aînés."",,2021-05-21,""Volunteer Canada"",5,113";;;;;;
"Coronavirus : dès le 12 mars, fini l’isolement pour les cas contacts au Québec,https://www.youtube.com/watch?v=ljkkNqcBsbw,""Le directeur national de santé publique par intérim, le Dr Luc Boileau, a annoncé en conférence de presse jeudi que de nouveaux assouplissements entreront en vigueur le 12 mars pour les personnes qui ont été en contact avec des cas de COVID-19. Les finissants du secondaire auront quant à eux droit à un bal de fin d'année. Les détails avec Jean-François Blanchet.  N.B. : Le masque n'a pas été aboli dans les écoles primaires et secondaires, mais plutôt dans les classes.   Pour en savoir plus : http://rc.ca/SLSn7l ____________________________________________ Abonnez-vous à l’infolettre ICI Québec  https://ici.radio-canada.ca/infolettres/quebec/ ____________________________________________ Suivez ICI Québec sur différentes plateformes Facebook : https://www.facebook.com/iciquebec/  Twitter : https://twitter.com/iciquebec  Instagram : https://www.instagram.com/iciquebec/ TikTok : https://www.tiktok.com/@iciquebec"",,2022-03-11,""ICI Québec"",35,5307";;;;;;
"Replay Webinaire PS Evolution du Contact Tracing - suivi de l&#39;isolement,https://www.youtube.com/watch?v=68QGpEg9dj8,""Webinaire CPAM 93 du mardi 19 janvier 2021 dédié aux infirmier.ères sur la visite à domicile et le suivi des patients testés positifs à la Covid-19  Retrouvez toutes les informations utiles sur ameli.fr : https://www.ameli.fr/seine-saint-denis/infirmier/actualites/suivi-de-lisolement-et-visite-domicile-des-patients-testes-positifs-la-covid-19"",""Covid19 Webinaire isolement"",2021-01-19,""Assurance maladie de la Seine-Saint-Denis"",14,753";;;;;;
"En apprenant à être moi | Greg Egan,https://www.youtube.com/watch?v=d1znpwDI9IU,""Lien vers la vidéo où je reviens sur la nouvelle du point de vue de la philosophie de l'esprit : https://youtu.be/tPgmr-6A10M  Aujourd'hui, une lecture audio d'une des plus vertigineuses nouvelles de Greg Egan : """"En apprenant à être moi"""". Traduit par Sylvie Denis et Francis Valéry, publié aux édition du Bélial' dans le recueil """"Axiomatique"""".  Les édition du Bélial' : https://www.belial.fr/ Nouvelles de Greg Egan : """"Axiomatique"""" https://www.belial.fr/greg-egan/axiomatique Radieux : https://www.belial.fr/greg-egan/radieux Océanique : https://www.belial.fr/greg-egan/oceanique     Si vous voulez d'autres lectures audio de SF : https://www.youtube.com/playlist?list=PLuL1TsvlrSneBhR6ea58QLMRKfGLdDCSl  Vous pouvez aussi les retrouver en podcast sur Spotify, Deezer ou Podcast addict (cherchez """"Monsieur Phi le podcast"""".)  Et pour écouter mon livre """"Curiosités philosophiques"""" lu par mes soins, il faut l'obtenir sur Audible. Si vous n'y êtes pas déjà abonné, vous pouvez même l'obtenir pour la modique somme de rien du tout. Pour ça, passez par ce lien ici https://audible.fr/monsieurphi et abonnez-vous. Les deux premiers mois sont gratuits, cela vous donne deux crédits que vous pouvez utiliser pour acheter deux livres de votre choix (donc au pif le mien et Greg Egan, allez), vous les téléchargez et si vous ne voulez rien de plus vous pouvez vous désabonner juste après (les livres téléchargés restent à vous, même désabonné).   Voilà voilà.   _____________________________    Mon livre """"Curiosités philosophiques, de Platon à Russell"""" : https://amzn.to/3hIshrw   Méthodo de la dissertation et de l'explication de texte pour le bac : https://amzn.to/3c21RjE  Suivez aussi AXIOME, podcast mathématico-philosophique avec Lê (Science4All)   ---- https://www.youtube.com/channel/UCNHFiyWgsnaSOsMtSoV_Q1A ----   La principale source de financement de la chaîne est le financement participatif. Merci pour tous vos dons !   UTIP : -----  https://utip.io/mrphi  ------  TIPEEE : -----  https://www.tipeee.com/monsieurphi  -----  (Si vous hésitez entre les deux, préférez uTip. Ils ont le bon goût de ne pas financer des documentaires complotistes comme """"Hold up"""".)  Ou pour me faire un don direct :  PAYPAL : -----  paypal.me/monsieurphi   -----   Pour me suivre ailleurs :  Twitter : https://twitter.com/monsieurphi  Facebook : https://www.facebook.com/graindephilo/  Tiktok : https://www.tiktok.com/@monsieurphi  Instagram : https://www.instagram.com/monsieur.phi/  Sur PeerTube aussi : https://indymotion.fr/video-channels/monsieur_phi/videos  Et pour acheter des petits goodies : https://utip.io/mrphi/shop"",""philosophie Greg_Egan Hard_SF conscience esprit cerveau pensée"",2019-01-02,""Monsieur Phi"",4176,78622";;;;;;
"Kate Middleton et le Prince William  : Une Love Story Royale - Documentaire COMPLET en Français,https://www.youtube.com/watch?v=IpmHiCc3yWk,""L'histoire vraie de la rencontre et du coup de foudre en Kate et William...   Les Films à VOIR ?  Ils sont ICI ► https://www.youtube.com/playlist?list=PL843D2ED8D80FA673  Kate Middleton et le Prince William  : Une Love Story Royale  © 2018 - Factoris Films  Comédies familiales, films d'action, d'animation ou de super-héro, de science fiction ou d'humour, films français ou blockbusters américains... Il y en a pour tous les goûts !   Abonnez-vous dès maintenant pour ne pas rater la bande annonce en français VF ou le trailer VOST / VOSTFR  du moment ainsi l'extrait vidéo ou scène des films prochainement au cinéma.  Filmsactu : un point complet sur l'actualité du grand écran et les nouveautés DVD & Blu-Ray !"",""film cinema kate_middleton prince_william william documentaire reportage histoire vraie complet"",2017-12-17,FilmsActu,1321,244687";;;;;;
"DIMENSION,https://www.youtube.com/watch?v=qRYNK5QwDXo,""Retrouvez Ratchet & Clank : Rift Apart sur le PS Store : https://www.playstation.com/fr-fr/games/ratchet-and-clank-rift-apart/?emcid=di-1s-412006   Mon Instagram : http://bit.ly/MichouINSTA  Mon Twitter : http://bit.ly/MichouTweet  Mon Twitch : http://bit.ly/MichouTwitch  Merci à Piwerre pour sa participation, sa chaîne : https://youtube.com/c/Piwerre Merci à Pidi pour sa participation hors du commun, sa chaîne : https://youtube.com/c/Pidi_meg Et merci à Riadh toujours présent, sa chaîne : https://youtube.com/channel/UCIFLzrXGmPv4lvfo-FrY-9w   Salut ! Aujourd'hui nouvelle vidéo très particuliere ! Aujourd'hui on va jouer à Ratchet & Clank : Rift Apart sauf que, cela ne va pas se passer comme prévu et je vais être transporter dans une autre dimension avec une faille ... Cette vidéo est surtout mon premier court métrage ça change vraiment de d'habitude j'espère que vous allez kiffer !  Encore merci à Sony PlayStation pour le partenariat c'est aussi grâce à eux que ce projet prend vie  Achetez le jeu sur le PS Store : https://www.playstation.com/fr-fr/games/ratchet-and-clank-rift-apart/ #RatchetPS5 Abonne-toi !   Devenir sponsor sur iOS : http://bit.ly/SoutieniOS  Chaîne secondaire : http://bit.ly/BobbyYtb   Adresse mail Pro : michou.video.officiel@gmail.com"",""michou dimension court_metrage rift_apart video video_michou"",2021-06-09,Michou,266461,4023515";;;;;;
